"Motif Reference","Motif Title","Location / Tradition",Latitude,Longitude,"Narrative Text",source,berezkin,other_data
F40A,"The common husband of the first women.","Kabiyari, Yukuna (Yucuna)",-1,-70,"Kawarimi's older brother sends younger Maotchi to the tree for parrot eggs; asks four times what they are; each time hears My daughter-in-law Like ; breaks off a branch, M. falls into the hollow; K. leaves, takes his wife M.; parrots carry M. food; when they fly away, M. crawls like an ant inside the trunk below; asks the Aguti woman to help, promises to lie down with her for it; she cuts through with an ax a hole in the trunk, with the last blow breaks M.'s spine; heals, but since then people have back pain; they lie down with a jack in her hammock; she starts eating it with her anus; bit the bottom of his body; he asks for I am eating from the garden of his children's mother; Agouti returned, said that his wife scolded her; next time Aguti is in the form of a man, his wife gave her food; M. returns home, first asking her son not to tell his mother; digs a hole in the garden to the lower world (a hole in the center of the world); sends his son for K.; jumps into a hole, climbs out a vine; K. jumps, falls, screams, Cotton, cotton ; M. screams, Stone, stone ; picks up his wife; K. waits, the Sun's boat sails past the underground river; his crew Kojopana and Lu'uina, black with the heat; K. waits for the boat of the Month, the little brother of the Sun; K. kills flies, the Month says it's his sailors; stopped to eat, the Month asks for a top with fish, K. sees an anaconda; The month gets it himself; the cauldron, the plate  -  curled snakes; the calebass  -  the wasp's nest; the tapir bone The month cut off K.'s tip tongue, he turned into a toad; K. refuses to marry Ocherie Months; he brings him to maloka, where women want to copulate; the old woman's vagina swallowed him, the Month pulled him out; K. met in the forest woman; she says she was bitten by a jaguar, but her wounds were caused by a bat; K. healed her; Maloki's mistress said that this woman was too young; gave her to an old woman, she turned young at night, they have a son; grew up, his they are going to eat, he is a deer; a penis ( grandfather ) in the form of a hemp with a worm inside warns K. that they want to eat it; the son has been killed, his mother is eating him too; all the ways out of the maloka screams when K. tries go out; he runs away through a hole in the roof; wasps bite the pursuers, they come back; K. comes to the Month; the owner of the animals is a big grasshopper; copulates with her sons; K. - at an animal festival ; closes his eyes, finds himself on the ground in the form of an umari fruit; falls, turns into a man, sees his sons; kills his brother and unfaithful wife; promises to see how they get out of the lower world now ; marries M.; one by one asks three groups of cranes to take him; the latter give him feathers; tell him not to look down when they fly on the little ones, or else they fall; people shoot arrows at the cranes, They scream that a scorpion, ant, spider are biting; he looks at the next little one, falls, cranes pick him up, bring his aunt to her husband; this is an anaconda; etc.; see motive I14",https://www.folkloredatabase.com/db_index.php?pl=db_read_story&guid=otegxau4hzw7quwweckbtc7g,https://www.ruthenia.ru/folklore/berezkin/f40a.html,"yukuna : Jacopin 1981:69-130."
F45,Amazons.,"Kabiyari, Yukuna (Yucuna)",-1,-70,"Kawarimi's older brother sends younger Maotchi to a tree for parrot eggs; asks four times what they are; each time she hears my daughter-in-law ; breaks off the branch, M. falls into the hollow; K. leaves, takes his wife M.; parrots carry M. food; when they fly away, M. an ant crawls inside the trunk below; asks the Aguti woman to help, promises to lie down with her for this; she cuts a hole in the trunk with an ax, breaks M.'s spine with the last blow; heals, but since then people have pain in the back; they lie down with a jack in her hammock; she starts eating his anus; bit the bottom of his body; he asks for food from his children's mother's garden; Agouti came back, said that his wife scolded her; in Next time Aguti is in the form of a man, his wife gave her food; M. returns home, first asks his son not to tell his mother; digs a hole in the garden to the lower world (a hole in the center of the world); sends his son for K.; jumps into a hole, climbs out a vine; K. jumps, falls, screams, cotton, clap ; M. screams, Stone, stone ; picks up his wife; K. waits, a Sun boat sails past the underground river; his crew Kojopana and Lu'uina, black with the heat; K. waits for the boat of the Month, the little brother of the Sun; K. kills flies, the Month says they are his sailors; stopped to eat, the Month asks for a top with fish, K. sees anaconda; The month gets it by itself; the cauldron, the plate are curled snakes; the calebasa is the wasp's nest; the month cut off the tip of K.'s tongue, which turned into a toad; K. refuses to marry the daughter of the Month; that brings him to maloka, where women want to copulate; the old woman's vagina swallowed him, the Month pulled him out; K. met a woman in the forest; she says she was bitten by a jaguar, but her wounds were caused by a bat; K. cured her; Maloka's mistress said that this woman was too young; she gave it to an old woman, she turned young at night, they had a son; he grew up, they were going to eat him, he was a deer; a penis ( grandfather ) in the form of a hemp with a worm inside warns K. that they want to eat him; his son was killed, his mother eats him too; all the exits from Maloka scream when K. tries to get out; he runs away through a hole in the roof; wasps bite the pursuers, they return; K . comes to the Month; the owner of the animals is a big grasshopper; copulates with her sons; K. at an animal festival; closes her eyes, finds herself on the ground in the form of an umari fruit; falls, turns into K. sees his sons; kills his brother and unfaithful wife; promises to see how they now get out of the lower world; marries M.; one by one asks three groups of cranes to take him; the latter give he has feathers; they tell him not to look down when they fly on little ones, or else he falls; people shoot arrows at the cranes, they shout that a scorpion, ant, spider are biting them; he looks at the next little one, falls, cranes pick it up, bring it to their aunt's husband; it's an anaconda; etc.; see motive I14",https://www.folkloredatabase.com/db_index.php?pl=db_read_story&guid=3mtpzeewt7x4iwm8ukdgj3s8,https://www.ruthenia.ru/folklore/berezkin/f45.html,"yukuna : Jacopin 1981:69-130"
F46,"One for all.",Tanana,64.5,-147.5,"woman walks away from her unfaithful husband; comes to man; he has a big wife killing new wives by throwing a horn at them; woman throws her horn back, killing her; husband glad; woman comes to ten brothers; they have one wife for all; this is a cannibal with two faces; a woman lives with her youngest brother; a two-faced woman throws her son into boiling water; a woman cuts her to pieces, replaces her in the role brothers' mistresses; runs on mother-in-law's advice; brothers kill each other, turn into wolves; first husband finds a woman, she returns to him",https://www.folkloredatabase.com/db_index.php?pl=db_read_story&guid=4f1571e9d007ac209fad44e2,https://www.ruthenia.ru/folklore/berezkin/f46.html,
F46,"One for all.",Crash,N/A,N/A,"Schultz 1950:144-150; the husband was convinced that his wife was unfaithful; decided to leave, the children went with him; three boys and two girls together with their father became horses, but the average girl could not turn; same in another family, where everyone turned into deer, the youngest girl could not, but turned golden brown; Autxetpirire poisoned fish with poison; father and children became kingfishers to catch fish, climbed the tree, the middle daughter could not; A. asked how to become the same color as the girl; the father said to lie down in the oven, cover it with leaves and earth on top; A. stayed in the oven, everyone left, but the middle girl came back for the forgotten calebass, dug up A.'s penis, began to eat; followed her father's footsteps, A. began to get out of the oven; Cayman volunteered to transport the girl, asked in the middle of the river if she would name she denied, when she was on the shore, called him; hid under Emu's arm, Emu replied to Cayman that she had a pain in her armpit, not to raise her arm; the same with another caiman, the girl became a bird hid in the wasp nest, they did not give her away; her family reached the palm tree, at the top, they told the palm tree to bend down, she climbed in; she spat, giving them to A.; they lowered the rope, let him go, he fell, crashed, became a crab, climbed into a hole; the girl fell behind again, came to Serie's house, next to the Vulture House; climbed a tree by the water; Seriema's daughter came for water, the girl spat, the calebasa slipped out, crashed; so 4 times; The mother series wants to punish her daughter, she talks about a girl on a palm tree; comes to a bird village; hides in a tree at the spring; Vultures, Royal Male Vultures, even Seriema's husband convinced her to go down, raped her using different parts of her body for copulation; she died; each hawk took a piece of her vulva, tied her with amber fibers; made a house out of sticks, each piece on a stick, told them to stretch, the pieces covered the stick, it turned out to be a house; the pieces of her body put on sticks by others dried",https://www.folkloredatabase.com/db_index.php?pl=db_read_story&guid=bacd91b8b18088fbe24b0b85,https://www.ruthenia.ru/folklore/berezkin/f46.html,
F46,"One for all.",Crash,N/A,N/A,"the husband was convinced that his wife was unfaithful; decided to leave, the children went with him; three boys and two girls became horses with their father, but the average girl could not turn; the same in another family, where they all became deer, the youngest girl could not, but turned golden brown; Autxetpirire poisoned the fish with poison; the father and children became kingfishers to fish, climbed the tree, the middle daughter could not; A. asked how to be the same color as a girl; father said to go to the oven, cover it with leaves and soil; A. stayed in the oven, everyone left, but the middle girl came back for the forgotten calebasa, dug up her penis A., began to eat; followed in her father's footsteps, A. began to get out of the oven; Cayman volunteered to transport the girl, asked in the middle of the river if she would call him frosty; she denied, when she was on the shore, called him; hid under Emu's arm, Emu told Cayman that her armpit hurt, did not raise her arm; the same with another caiman, the girl became a bird, hid in the wasp's nest, they did not betray her; she reached a palm tree, on At the top of her family, they told the palm tree to bend down, she climbed the girl; spat, giving them to A.; they lowered the rope, let him go, he fell, crashed, became a crab, climbed into a hole; the girl fell behind again, came to Seria's house, near the Vulture House; climbed a tree by the water; Seriema's daughter came for water, the girl spat, the calebasa slipped out, crashed; so 4 times; The mother series wants to punish her daughter, she talks about a girl on a palm tree; comes to a bird village; hides in a tree at a spring; Vultures, Male Royal Vultures, even Seriema's husband convinced her to go down, raped her using different parts of her body to copulate; she died; each hawk took a piece of her vulva, tied it with embir fibers; made a stick house, each piece on a stick, told them to stretch, pieces they covered the stick, it turned out to be a house; the pieces of her body put on sticks by others dried up",https://www.folkloredatabase.com/db_index.php?pl=db_read_story&guid=7a88f72a75bdc6d2a316b249,https://www.ruthenia.ru/folklore/berezkin/f46.html,"Wilbert, Simoneau 1984a, No. 142 : 434"
F46A,"Woman in a tree.",Crash,N/A,N/A,"Schultz 1950:144-150; the husband was convinced that his wife was unfaithful; decided to leave, the children went with him; three boys and two girls became horses with their father, but the average the girl could not transform; the same in another family, where everyone turned into deer, the youngest girl could not, but turned golden brown; Autxetpirire poisoned fish with poison; father and children became kingfishers , they climbed a tree to fish, the middle daughter could not; A. asked how to become the same color as the girl; the father said to lie down in the oven, cover it with leaves and soil on top; A. stayed in the oven , everyone left, but the middle girl came back for the forgotten calebass, dug up A.'s penis, began to eat; followed her father's footsteps, A. began to get out of the oven; Cayman volunteered to transport the girl, asked in the middle of the river whether she would call him disgusting; she denied when she was on the shore, called him; hid under Emu's arm, Emu told Cayman that she had a pain in her armpit, not raise her arm; the same with another caiman, girl became a bird, hid in a wasp nest, they did not give it away; she reached the palm tree, her family was at the top, they told the palm tree to bend down, she climbed in; she spat, giving them to A.; they lowered the rope, let him go, he fell, crashed, became a crab, climbed into a hole; the girl fell behind again, came to Serie's house, near the Vulture House; climbed a tree by the water; Seriema's daughter came for water, the girl spat, calebasa slipped out, crashed; so 4 times; The mother series wants to punish her daughter, she talks about a girl on a palm tree; comes to a bird village; hides in a tree at the spring; Vultures, Royal Vultures- men, even Seriema's husband, persuaded her to go down, raped her using different parts of her body for copulation; she died; each hawk took a piece of her vulva, tied it with amber fibers; did a stick house, each piece on a stick, told them to stretch, the pieces covered the stick, it turned out to be a house; the pieces of her body put on sticks by others dried up",https://www.folkloredatabase.com/db_index.php?pl=db_read_story&guid=72cda133d7f69ea82b718d23,https://www.ruthenia.ru/folklore/berezkin/f46a.html,
F47A,"Parts of the female body.",Crash,N/A,N/A,"Schultz 1950:144-150; husband found his wife unfaithful ; decided to leave, the children went with him; three boys and two girls became horses with their father, but the middle girl could not transform; the same in another family, where everyone turned into reindeer, the youngest girl could not, but turned golden brown; Autxetpirire poisoned fish with poison; father and children became kingfishers to fish, climbed a tree, the middle daughter could not; A. asked how to become the same colors like a girl; the father said to lie down in the oven, cover it with leaves and earth; A. stayed in the oven, everyone left, but the middle girl came back for the forgotten calebasa, dug up A.'s penis, and began to eat; followed in her father's footsteps, A. began to get out of the oven; Cayman volunteered to transport the girl, asked in the middle of the river if she would call him frosty; she denied, once on the shore, called him; hid under With Emu's mouse, Emu told Cayman that she had a pain in her armpit, did not raise her arm; the same with another caiman, the girl became a bird, hid in a wasp nest, they did not betray her; she reached the palm tree, at the top of her family, they told the palm tree to bend down, the girl climbed in; spat, giving them to A.; they lowered the rope, let him go, he fell, crashed, became a crab, climbed into the hole; the girl fell behind again, came to the house Serie, next to him Vulture House; climbed a tree by the water; Seriema's daughter came for water, the girl spat, the calebasa slipped out, crashed; so 4 times; The mother series wants to punish her daughter, she talks about the girl on palm tree; comes to a bird village; hides in a tree by the spring; Vultures, Male Royal Vultures, even Seriema's husband convinced her to go down, raped, using different parts for copulation her body; she died; every hawk took a piece of her vulva, tied it with embir fibers; they made a stick house, each piece on a stick, told them to stretch, the pieces covered the stick, they made a house; The pieces of her body put on sticks by others are dry",https://www.folkloredatabase.com/db_index.php?pl=db_read_story&guid=528a7cad74e50c72c93d216c,https://www.ruthenia.ru/folklore/berezkin/f47a.html,
F51B,"Finds by the thread.","Oirats (incl Torgouts, Derbets, Oilots)",44.08057,96.5332,"Geser Khan came to Losynai = Khan; daughter of that Anim- Mergen Khatun sewed a long thread into G.'s fur coat; on the trail of the thread, she caught up with G., began to ask; G.: I was reborn into different images until the age of 16; I invent what people lack for bliss; in other books say that he figured out how to make fire by flint; extract water in a waterless place; make the footsteps of an approaching thief and wolf audible; cause an unfaithful wife to appear incriminating her tail",https://www.folkloredatabase.com/db_index.php?pl=db_read_story&guid=7e0ed8d133f285f237bbcc0f,https://www.ruthenia.ru/folklore/berezkin/f51b.html,
F59,"Man in woman: modelling the figure.","Northeastern Yakuts (Sakha): Yana, Indigirka And Kolyma Basins",67.55,133.39,"Coyote's wife Heron ate salmon and he ate roots; she tells salmon not to smell so that Coyote would not know what she was eating; pretending to be sick, and when The Coyote left, caught salmon; when Coyote fell asleep, went dancing, leaving the acorns responsible for herself; Coyote came there dressed as an old woman, with a child in his arms (actually his penis); told the Lizard that the child was “hers” and the husband was killed; asked the Lizard to put flint knives on his back, threw it up, the knives cut the Lizard, he died; the Coyote put his skin on; sent his penis home to put poultices on both cheeks Herons; when he entered the steam room, some guessed it was Coyote because he blinked; he explained that he had a sore throat and told him to dance; at that time his unfaithful wife Heron came; everyone shouted that The best dancer is coming, Coyote's wife; the Coyote smeared everything with tar and set it on fire; Duck and Goose, who immediately rushed into the lake, survived",https://www.folkloredatabase.com/db_index.php?pl=db_read_story&guid=366beb84ae34af86770a998b,https://www.ruthenia.ru/folklore/berezkin/f59.html,
F60,"The trickster heals the girl.",Tsimshian,54.5,-129,"Txamsen was wandering, saw a beautiful woman; she complained of abdominal pain; T.: I'm a great shaman, now I'm going to the woods, and you go out and call for “medicine, medicine”; hear the answer When you see a plant protruding from the ground, you have to sit on it to enter the vagina; it happened, but this woman was nettle and after copulating T. was in terrible pain; he came to another place where is an empty house; he went into it, then returned to the boat: there is a woman in her; says she is salmon; when T. fell asleep, went to the river and filled it with salmon; T. caught a lot; crows began to steal salmon from boats; T. took out his eye and told him to guard the salmon, and went to get firewood; his eye screams that crows were stealing salmon and attacked himself; when T. returned, his eye had already been eaten; his wife made him a new eye; together with his wife they prepared a lot of dried salmon; everything was fine, but T. accused his wife of infidelity  -  otherwise why did he lose to Pnya; the woman could not stand it, called her people and disappeared into the river; all the dried salmon came to life and disappeared with her; T. got into the boat and sailed down the Ness River again",https://www.folkloredatabase.com/db_index.php?pl=db_read_story&guid=9bfe5e5bae9f2d583e1f2cec,https://www.ruthenia.ru/folklore/berezkin/f60.html,
F62,"Incognito at a festival.","Northeastern Yakuts (Sakha): Yana, Indigirka And Kolyma Basins",67.55,133.39,"Coyote's wife Heron ate salmon and he ate the roots; she tells the salmon not to smell so that Coyote would not know what she was eating; pretending to be sick, and when Coyote left, she caught salmon; when Coyote fell asleep, she went to dance, leaving the acorns responsible for herself; Coyote came there, dressed as an old woman, a child was in her arms (actually his penis); told the Lizard that the child was “hers” and her husband was killed; asked the Lizard to put flint knives on his back, threw it up, cut the knives The lizard died; the Coyote put on his skin; sent his penis home to put poultices on both Heron's cheeks; when he entered the steam room, some guessed it was Coyote because he blinked; he explained that he had his throat hurts, tells me to dance; at this time his unfaithful wife Heron came; everyone began to scream that the best dancer, the wife of Coyote, was coming; Coyote smeared everything with tar and set fire; Duck and Goose escaped, who immediately rushed into the lake",https://www.folkloredatabase.com/db_index.php?pl=db_read_story&guid=6a6b93c9d31caf862aaa8554,https://www.ruthenia.ru/folklore/berezkin/f62.html,
F65,"The imaginary dead man.","Kwakiutl (Kwakwaka&#039;wakw)",51,-127.3,"Raven The Great Inventor suspects his wife, Saw-billed Duck, of infidelity; she goes to dig oysters; BB sends the Raven to trace, he says that she has a Young Raccoon in her lovers and Raccoon; BB pretends to be sick; his wife gives him oysters, he says juice is like milk, a sign of her infidelity; pretends to be dead, buried; passing by his grave, his wife says she lives with Raccoon; BB Rises from the grave; becomes a great shaman",https://www.folkloredatabase.com/db_index.php?pl=db_read_story&guid=e832fa4e22aa87c6103e09e1,https://www.ruthenia.ru/folklore/berezkin/f65.html,
f65c,"The imaginary dead man: the boy reveals the deception.","Sarsee (Tsuu T&#039;ina)",52.5,-116,"a woman has a husband and a seven-year-old son; she wants to leave for her lover; she hides a bottle of blood under her clothes, pretends to be bleeding, as if she were dying, tells her husband to leave her body on a tree not far above the ground; her lover lowers her to the ground, dresses her in men's clothes, and passes her off as a friend; she visits her son and gives him a bow and arrows; her husband suspects something, gathers people, orders everyone to make arrows, the woman does not know how, does it badly; her husband leaves her and her lover in the tipi, rushes at his wife with a knife; she screamed that she would become a partridge, flew up, but her husband managed to cut off one of her legs; the woman flew up to the sky and became the moon; unfaithful wives are said to be like the moon",https://www.folkloredatabase.com/db_index.php?pl=db_read_story&guid=haSAHgbjfE6aXPgMPsHpww,https://www.ruthenia.ru/folklore/berezkin/f65c.html,(cf.)
F70C,"The castrated becomes a man (ATU 318).","Mehri; Harsusi, Jibbali (Shahri, Shauri)",17,52.2,"when leaving, the sultan tells his son to kill the child, which a wife should give birth if a girl is born, save if a boy; the wife gives the girl to an old woman, the brother buries the sheep; the girl grows up, the old woman tells her not to leave the house, she goes out to drive the chickens away from the grain, the sultan sees her, wants to marry her; the deception is revealed; the sultan tells his son to kill his sister; he leaves with her; they live by the stream, the brother hunts; the sister's hair swims along to the current, an old woman picks him up; the infidel tells her to find a girl; they come to her; she tells her to kill her brother; invites him to play, the loser will be tied to the bench; ties firmly, unfaithful breaks the young man, takes his sister away; the cat gnaws through the fetters; the young man recovers, leaves; the Sultan's daughter sees him, agrees to marry him, even if he is a castrato; the infidel meets the young man, tells the Sultan that his son-in-law is a castrate; he promises to execute the infidel and his wife if it is a lie, or let him and his son-in-law execute if true; in the evening the wife lowers the young man out the window, he leaves; three angels promise to restore him courage if he gives them half of his future children; they tell them to wake them up when the sea is not white or black, but green; he wakes him up, he is thrown into the green sea, his genitals regenerate; at night he sleeps with his wife; cuts off the head of his sister and the infidel; the wife gives birth to three children; when he divides them, he cuts one, leaves, taking half; the angels call out to him, connect the halves, lets him go to his wife together with three children; everything is fine",https://www.folkloredatabase.com/db_index.php?pl=db_read_story&guid=2be2b91ecdb7d6b865a432c0,https://www.ruthenia.ru/folklore/berezkin/f70c.html,
F71,"Susanna and the Elders, ATU 883A.",Armenians,39.92952,43.65381,"when leaving for war, Tsar Avak leaves his wife Lusnik in the care of a minister named Gamayak; he tries in vain to seduce L.; accuses her of infidelity, A. orders her to be executed; G. orders L. to be killed with her child in the forest, the warriors let her go; she meets John the Baptist, converts to Christianity; A. finds her, returns her, converts to Christianity, executes G., cedes the throne to her son",https://www.folkloredatabase.com/db_index.php?pl=db_read_story&guid=c8fc82b2784cd7660879bbe3,https://www.ruthenia.ru/folklore/berezkin/f71.html,
