"Motif Reference","Motif Title","Location / Tradition",Latitude,Longitude,"Narrative Text",source,berezkin,other_data
,N/A,Germany,51.083,10.426,"The Three Roosters
Germany/France
We read about three roosters that crowed in the night while the lady of the house was lying with an adulterer. Now the kitchen maid understood the language of birds.
The first night the one rooster crowed, ""My mistress is unfaithful to my master.""

The kitchen maid reported this to the lady of the house. The woman said, ""That rooster must die,"" and the rooster was broiled.

The next night the second rooster sang, and when the kitchen maid was asked about it, she said that the rooster had crowed, ""My companion died for telling the truth.""

Then the lady of the house said, ""He too shall die,"" and this rooster was immediately broiled.

The next time the woman went to bed with her lover, the third rooster crowed, as interpreted by the kitchen maid, ""See, hear, and remain silent, if you want to live in peace.""

Audi, vive, tace,
Se vis vivere in pace.",https://www.folkloredatabase.com/db_index.php?pl=db_read_story&guid=GSJvOAJ02cVoFhQFG2ABSbaP,N/A,
,N/A,"Russian Federation",59.039,98.67,"Once upon a time there lived in a Russian village an old peasant woman who had two sons. One, however, died; and the other was from home, but was soon expected to return to his native village.

One evening, as the peasant woman was working in her little hut, a soldier walked in at the open door. ""Good day, little mother!"" he said. ""Can I stay here the night?""

""Yes, certainly, with pleasure, little father. But whence come you, and who are you?""

""I am nobody in particular, little mother. I am an emigrant for the next world.""

""Ah! My precious soul! One of my sons died a little while ago. Did you happen to come across him?""

""Why, yes, of course! We lived in the same sphere.""

""No, really! You don't mean it?""

""He feeds and looks after the young cranes in the next world.""

""Oh, my precious soul! But where did he get them?""

""Where did he get them! Why, the young cranes roam about among the sweet-briar!""

""How did he look? What clothes had he on?""

""Clothes!"" He was all in tatters, and a pair of wings.""

""Poor fellow! Well, I have got about forty yards of gray cloth and a ten-ruble note. Take them, good man, and give them to my son.""

""With pleasure, little mother.""

Next morning the old woman gave the soldier the cloth and the money, and wished him a safe journey back. And she also begged him to come again soon and tell her how her son was getting on.

She waited and waited for many a week, but the soldier did not return. At last the day arrived when her other son was expected home.

""How are you, mother mine?"" he exclaimed, coming into the hut and embracing his mother. ""Have you any news?""

""Yes, my boy. Not very long ago an emigrant from the other world came to stay the night here, and he brought some news of your brother, for they both lived in the same sphere. But he said that the poor fellow had nothing but a pair of wings, so I gave him forty yards of cloth and ten rubles.""

""Good gracious, mother, you have given away everything we had. And for what? Just because that man was artful enough to tell you a lot of lies. It really is most astonishing how confiding some people are! I think I will go into the wide world and tell a lot of lies, and see whether, after cheating everybody, I become a very rich man or not. If I succeed, I shall come home again, and then we can live happily together, and have food and money in plenty ever after.""

Next day the son went off to try his luck. He went on and on until he came to an estate belonging to a rich Russian barin or gentleman. He walked up to the lordly mansion and saw, in a garden near the house, a large pig with a number of little ones walking about. A thought struck him, and he went down on his knees before the pigs, and began making most polite bows to them.

Now the mistress of the house, who was looking out of one of the windows, saw the performance, and was greatly amused. ""Go,"" she said to one of her maids, ""and ask the mujik [peasant] what he is bowing for.""

The maid went up to the peasant, saying, ""Little mujik, tell me why you are on your knees before the pigs, and why you are bowing to them? My lady has sent me to ask.""

""Tell your mistress, my little dear, that yonder pig is my wife's sister, and my son is going to be married tomorrow, so I am asking her and her young ones to come to the wedding. That is all. And she has consented, on condition that your lady allows them. So go and ask your mistress whether she will let them come with me.""

The girl burst out laughing, and went straight to her mistress, who also began laughing heartily when she heard all the peasant had said. ""What a donkey!"" she cried. ""Fancy asking the pigs to his son's wedding! Well, never mind. Let all his friends have a good laugh at him. Yes, he may take the pigs. But first dress them up in my shuba (fur coat), and let the coachman get my own little carriage and team ready, so that the pigs need not go to the wedding on foot.""

When the carriage was ready, they dressed the pig up in the lady's fur coat, and placed it in the carriage with the young ones, and gave the reins to the peasant, who at once rode away homewards.

Now the master of the house, who was away shooting at the time, returned home a few minutes after the peasant had left. His wife ran out to meet him, laughing.

""I am so glad you have returned, my dear!"" she said, ""as I am longing to have someone to laugh with. Such a funny thing happened while you were away. A peasant came here and began kneeling and bowing before our pigs. He declared that one of them was his wife's sister, and he was asking her and the little ones to come to his son's wedding!""

""Yes,"" the husband replied. ""and did you let her go?""

""Of course I did. I even had the pig dressed in my best shuba, and had her put in my own little carriage and team, and let the peasant drive it himself. I think it was nothing but right for me to do so. The peasant was so very polite to the pigs. What do you think, my dear?""

""What did I think? Well this: that the peasant was an ass, and you were another!""

And the good man, like the rest of his sex, thought it was a splendid opportunity for flying into a rage. He told his wife that she had been cheated, and then rushing out of the house, he flung himself upon his horse and galloped off after the peasant, who, when he heard that he was being being pursued, conveyed the carriage and team into a dark forest hard by, and then going back, took off his cap, seated himself near the entrance of the forest, put the cap beside him on the ground, and waited until the horseman came up to him.

""Hark you, little father!"" cried the barin, ""have you seen a peasant drive this way with a carriage and team and a number of pigs in it?""

""See him? I should rather think I did! He rode past a long time ago.""

""In which direction did he drive? How had I better go? Do you think I am likely to overtake him?""

""Yes, you could overtake him, I daresay. But the way he went by has many a turning, and you are sure to lose yourself. Is the road quite unknown to you?""

""Yes, little brother. I think, if you don't mind, it would be better for you to go in search of him and bring him back to me, for you seem to know the way so well!""

""No, brother, I could not possibly, for I have a falcon under my cap here and must watch it.""

""I can do that for you.""

""No, you are sure to let him out, and the bird is very valuable. Besides, if I lost it my master would never forgive me.""

""But how much is it worth?""

""Three hundred rubles, I should think.""

""Very well then, if I lose the bird I will pay the money.""

""No, brother, if you really want me to go after the peasant, you had better give me the money now, for heaven knows what might happen afterwards. You might lose the bird, and then take your departure too, and I should never see either the falcon or the money!""

""Oh, you incredulous man! Here, take the three hundred rubles anyhow!""

The peasant took the money, and at the barin's wish mounted his horse and rode off into the forest, leaving the barin to watch over the empty cap.

He waited and waited, but the peasant did not return, which he thought looked rather queer. The sun began to set. Still no peasant.

""Stop!"" thought the barin. ""Let me look and see whether there really is a falcon under that cap. If there is, then the peasant may possibly return. If not, well, then it is of no use waiting here and wasting my time."" He peeped under the cap, but no falcon was to be seen.

""Ah, the wretch! he laughed. ""I do believe that he was the very same man who cheated my wife out of her carriage and team, her shuba, and the pigs.""

He spat on the ground three times with vexation, and returned home to his wife penitent.

Meanwhile our friend the peasant had long since got safely back to his mother with all his treasures. ""Well, mother mine!"" he cried, ""this world of ours can certainly boast of some very good-natured fools. Just look, without any reason whatever, they gave me three horses, a carriage, three hundred rubles, and a pig with her little ones. Now we can live happily for some time at least, thanks to the stupidity of these people. It really is wonderful.

",https://www.folkloredatabase.com/db_index.php?pl=db_read_story&guid=sR52KPoCKDc1rVWWUTu7vU74,N/A,
,N/A,Italy,42.982,12.764,"Once upon a time there was a woman who had an inn where she provided shelter to travelers. She had a daughter who was so beautiful that one could not imagine anyone more beautiful. The mother could not stand her, precisely because she was so beautiful, and always kept her locked up in a room so no one could see her. The only person who knew about her was the maid who brought food to her every day.
One day it happened that the king wanted to spend the night at the inn. He arrived just as the maid was bringing food to the girl. Someone called the maid, and she forgot to close the door behind her. Noticing this, the innkeeper's daughter became curious and wanted to see the king. She stepped into the doorway, but when the king walked down the hall she quickly stepped back into the room. However, he saw her, and was completely blinded with her beauty.

""Where is the beautiful girl whom I saw in the hallway?"" he asked the maid who was serving him.

""Oh, your majesty,"" she answered, ""that is the innkeeper's daughter, and she is just as good as she is beautiful. But her mother keeps he locked up so that no one can see her.""

The king was so enchanted with her beauty that he wanted to marry her.

Because he could not ask the mother for her hand, he called for the maid and said, ""I shall remain here for a few days. Go to the daughter and ask her if she will be my wife.""

The maid went to the girl and said, ""Just think, miss, the king wants to marry you, and he wants to know if you will flee with him and escape from this house where you are treated so badly.""

""Oh,"" answered the poor girl, ""how would I be able to flee? My mother keeps such a strict watch over me.""

""Just leave it to me,"" answered the faithful maid.

She then went to the king and said, ""I know what you can do. Leave here tomorrow, as though you were returning to your home. Stop somewhere nearby. The girl will pretend to be sick, and I'll tell her mother that it is because she is always locked indoors. If she will let her go outside then I'll bring her to you. Take me with you, because I'll not be able to return without the girl.""

The king promised to do this, and the next day the king pretended to leave. However, he went only a short distance, then stopped at another inn, but without letting it be known that he was the king.

The innkeeper's daughter pretended to be sick and refused to eat anything, losing more and more weight.

""Just what does the girl have that makes her so ill?"" asked the mother.

""Of course the poor child is sick,"" answered the maid. She is always kept inside never gets any fresh air. Tomorrow let her go to the fair with me. Those few steps will bring her back to health.""

The mother agreed to this, and the next morning the maid and the daughter left for the fair. They were scarcely out of the mother's view when they rushed to the king, whose carriage was ready to go. He lifted the beautiful girl inside, and they rode away. He gave the faithful maid so much money that she was able to move to a different country with her entire family.

The king arrived at his castle and introduced his fiancée to his mother.

""This is my dear fiancée,"" he said, ""and now we want to have a splendid wedding.""

The girl was so beautiful that the old queen accepted her immediately. There was a splendid wedding, and the king and his young wife lived together happily and contentedly.

Nearly a year had passed when war broke out, and the king had to go off to battle.

He said to the old queen, ""Mother, dear, I must go away. I entrust my dear wife to you. If she should have a baby, let me know immediately, and take good care of it.""

With that he embraced his mother and his wife, and departed.

Not long afterward the young queen gave birth to her first son, and the old queen took good care of her. She immediately wrote a letter to the king telling him of the birth of his son.

The messenger carrying the letter to the king stopped to rest at the inn owned by the young queen's mother. Upon arriving there he ordered something to eat, and while he was eating, the innkeeper asked him where he was from and where he was going. He explained how he had been sent to report to the king the happy birth of his son. Hearing this, the innkeeper resolved to take revenge against her daughter for having escaped.

The messenger lay down and fell asleep, whereupon the innkeeper took the letter from his pocket and replaced it with a different one, claiming that the young queen had been guilty of the worst infidelity and deserved the strictest punishment. This was the letter that the messenger brought to the king.

This letter saddened the king greatly because he was so in love with his wife. Nonetheless, he wrote to the old queen that she should take good care of his wife and do nothing until he had returned. The messenger departed with this letter. Arriving at the inn, he once again ordered something to eat. The innkeeper asked if the king had sent a response with him.

""Yes,"" he answered, ""the letter is in my pocket.""

The messenger once again fell asleep after eating, and the innkeeper replaced the king's letter with a different one, wherein it was written that the young queen's hands should be chopped off, the child should be tied to her maimed arms, and that the two of them should be thus exiled into the wide world.

After receiving this letter the old queen cried bitterly, for she dearly loved her daughter-in-law.

However, the young queen meekly said, ""I shall do whatever my lord and husband commands!""

With that she had her own hands chopped off. The child was then tied to her arms so that she could nurse it. She then embraced the old queen and wandered away, far away into a dark forest.

After wandering a great while she came to a little brook. Because she was very tired she sat down.

""Oh,"" she thought, ""if only I had my hands I would not be so helpless. Then I could wash out my child's diaper and dress him with clean clothes. As it is, my innocent child shall soon die.""

As she thus spoke and wept, an old and distinguished man suddenly appeared before her and asked why she was crying. She told him of her sorrow and how she innocently had been inflicted with such severe punishment.

""Don't cry,"" said the old man. ""Come with me, and all will go well with you.""

He led her a little further into the woods, then he struck the ground with his staff, and suddenly a castle appeared, much grander than the king's castle. A garden was there as well, and the king himself did not have a better one. The old man was Saint Joseph, and he had come to the aid of the innocent young queen.

The young queen and her child lived with Saint Joseph in the beautiful castle, and because she was so good, Saint Joseph caused her hands to grow back. The child grew large and strong, and every day became more beautiful.

But now we shall leave the queen and see what is happening with the king.

The war ended, and the king sorrowfully returned to his castle. His wife's infidelity broke his heart.

""What have you done with my wife?"" he asked his mother.

""Oh, you wicked man,"" answered the queen, weeping, ""how could you cause your innocent wife to suffer so greatly?""

""What!"" he cried. ""Did you not write to me that she was guilty of great infidelity.""

""You say that I wrote that to you?"" said the queen. ""I reported the happy birth of your son, and you replied that I should have her hands chopped off and exiled into the wide world with her child.""

""I wrote no such thing!"" cried the king.

Then the two of them brought forth the letters, and said that they had not written them.

""Oh, my dear innocent child!"" sobbed the old queen. ""Now you are surely dead!""

Great sadness fell over the castle, and the king was so miserable that he turned seriously ill. He finally recovered but remained wretchedly unhappy.

One day the old queen said to him, ""My son, the weather is beautiful, why don't you go hunting? Perhaps it will distract you.""

So the king mounted his horse and sadly rode into the woods, but without hunting. Because of his grief he did not pay attention to where he was going, and soon found himself lost in the dense forest. His attendants did not dare to say anything to him. As it was growing dark the king wanted to turn back, but no one knew the right way, so they blundered ever deeper into the woods. Finally they saw a light in the distance, and following it they came to the beautiful castle where the young queen was living.

They knocked, and Saint Joseph opened the door and asked what they wanted.

""Oh, my good old man,"" answered the king. ""Could you give us shelter for the night? We are lost and cannot find our way back home.""

Saint Joseph invited them in, fed them, and offered them good beds. However, the young queen and her son did not show themselves.

The next morning, while the king was at breakfast, Saint Joseph went to the young queen and said, ""The king has spent the night here. Now is the moment when your sorrows shall cease.""

The queen dressed her son in his best clothes, and Saint Joseph had him go to the king, kiss his hand, and say, ""Good morning, papa, I would like to eat breakfast with you.""

Seeing the beautiful child, the king was very moved, but did not know why. Then the door opened and the young queen entered with Saint Joseph. She bowed before the king. He recognized his beloved wife and embraced her and his little son.

Saint Joseph approached them, saying, ""All your sorrows are now at an end. Live happily and contentedly, and if ever you have a wish, just call on me, for I am Saint Joseph.""

With that he blessed them and disappeared. The castle disappeared at the same time, leaving the king, the queen, their son and the attendants all standing in the woods. Before them they saw the pathway that led out of the woods and back to their castle. They came to the old queen who was happy from the bottom of her heart to see once again her beloved daughter-in-law and her little grandson. Then all together they lived happily and contentedly, but we, we went away with nothing.

",https://www.folkloredatabase.com/db_index.php?pl=db_read_story&guid=4LFuUTDyup32l06fKXMCoxzS,N/A,
,N/A,"Russian Federation",59.039,98.67,"In a certain kingdom in a certain land once there lived a tsar and a tsaritsa. He lived with her for some time, then he thought he would go to that far distant country where the Jews crucified Christ. So he issued orders to his ministers, bade farewell to his wife, and set out on his road.
It may be far, it may be short, he at last reached that distant land where the Jews crucified Christ. And in that country then the accursed king was the ruler. This king saw the tsar, and he bade him be seized and lodged in the dungeon. There were many tortures in that dungeon for him. At night he must sit in chains, and in the morning the accursed king used to put a horse-collar on him and make him drive the plough until the evening. This was the torment in which the tsar lived for three whole years, and he had no idea how he should tear himself away or send any news of himself to his tsaritsa.

And he sought for some occasion. And he wrote her this little line: ""Sell,"" he said, ""all my possessions and come to redeem me from my misfortune.""

When the tsaritsa received the letter she read it through and said to herself, ""How can I redeem the tsar? If I go myself, the accursed king will receive me and will take me to himself as a wife. If I send one of the ministers, I can place no reliance on him.""

So what did she advise? She cut off her red hair, went and disguised herself as a wandering musician, took her gusli, and never told anybody, and so set out on her road and way.

She arrived at the accursed king's courtyard and began to play the gusli so finely as had never been heard or listened to for ages. When the king heard such wonderful music he summoned the harpist into the palace.

""Hail, guslyar! From what land have you come? From what kingdom?"" asked the king.

""I do not journey far in the wide white world: I rejoice men's hearts, and I feed myself.""

""Stay with me one day and another day, and a third, and I will reward you generously.""

So the guslyar stayed on, and played for an entire day in front of the king, and he could never hear enough of her.

""What wonderful music! Why, it drove away all weariness and grief as though at a breath.""

So the guslyar stayed with the king three days, and, was going to say farewell.

""What reward can I offer you for your labour? "" asked the king.

""Oh, your majesty, give me one prisoner who has sat long in the prison. I must have a companion on the road! I wish to go to foreign kingdoms, and I have no one with whom I can exchange a word.""

""Certainly! Select whom you will,"" said the king, and he led the guslyar into the prison.

The guslyar looked at the prisoners, selected the tsar, and they went out to roam together.

As they were journeying on to their own kingdom the tsar said, ""Let me go, good man, for I am no simple prisoner, I am the tsar himself. I will pay you ransom for as much as you will; I will grudge you neither money nor service.""

""Go with God,"" said the guslyar. ""I do not need you at all.""

""Well, come to me as my guest.""

""When the time shall come, I will be there.""

So they parted, and each set out on his own way. The tsaritsa went by a circuitous route, reached home before her husband, took off her guslyar's dress and arrayed herself like an empress.

In about one hour cries rang out and the attendants came up to the palace, for the tsar had arrived. The tsaritsa ran out to meet him, and he greeted them all, but he did not look at her.

He greeted the ministers and said, ""Look, gentlemen, what a wife mine is! Now she flings herself on my neck, but when I sat in prison and sent her a letter to sell all my goods and to redeem me she did nothing. Of what was she thinking if she so forgot her liege husband?""

And the ministers answered the tsar, ""Your majesty, on the very day the tsaritsa received your letter she vanished no one knows where, and has been away all this time, and she has only just appeared in the palace.""

Then the tsar was very angry and commanded, ""My ministers, do ye judge my unfaithful wife according to justice and to truth. Where has she been roaming in the white world? Why did she not try to redeem me? You would never have seen your tsar again for ages of eternity, if a young guslyar had not arrived, for whom I am going to pray God, and I do not grudge giving him half my kingdom.""

In the meantime the tsaritsa got off her throne and arrayed herself as the harpist, went into the courtyard and began to play the gusli.

The tsar heard, ran to meet her, seized the musician by the hand, led her into the palace and said to his court, ""This is the guslyar who rescued me from my confinement.""

The guslyar then flung off his outer garment, and they then all recognised the tsaritsa. Then the tsar was overjoyed and for his joy he celebrated a feast which lasted seven whole days.

",https://www.folkloredatabase.com/db_index.php?pl=db_read_story&guid=gyDhbIEw5Wr49CwmnDfFsYsc,N/A,
