"Motif Reference","Motif Title","Location / Tradition",Latitude,Longitude,"Narrative Text",source,berezkin,other_data
K32G,"Torn apart by horses.","Sardinia, Corsica, Sardinians, Corsicans",41.16542,9.1582,"the merchant got confused with the accounting department; a girl came up, immediately failed all accounts; the merchant married her; one day, when I returned from Africa, I found out that my wife had fled with the captain of the ship, taking everything she could; the merchant threw everything, went wherever he looked; the old woman taught him that the captain would arrange for the merchant they will shoot; let him give a rose to the guard before his execution and teach him how to revive him; after coming out of the grave, the merchant comes to the city where there are black flags; the princess is dead, and those guarding her coffin are found in the morning dead; the merchant volunteered to be at church at night; the old lady at the inn teaches to hide in the baptistery; the next night under the bell; then at the altar; the princess is disgraced, the merchant gets her hand and throne; as king, he inspects troops; does not see the guard who saved him from the grave  -  he is in prison; the guards are returned and dressed; the king tells him to slowly put a bag of tobacco in the pocket of the captain who took the king's wife while he was still a merchant; the captain and cheating wife were torn with horses",https://www.folkloredatabase.com/db_index.php?pl=db_read_story&guid=1bd3650029b9288c4d349d4c,https://www.ruthenia.ru/folklore/berezkin/k32g.html,
K33H,"Cat, dog and magical object, ATU 560.","Greeks (modern), Balkarians",39,23,"( many options); the son of a poor woman (lazy) saves (buys) a snake, cat, dog, mouse; a snake teaches him to ask his parents for a ring or other object that fulfills wishes; with its help he performs the king's difficult tasks and marries a princess; a princess whose Moor lover steals a ring, sends her husband to a distant island; a dog and a cat return the ring (the mouse tickles the character, who holds the ring in his mouth, it falls out); they lose the ring in the sea, but find it in the caught fish; the hero returns everything, kills his unfaithful wife and her lover",https://www.folkloredatabase.com/db_index.php?pl=db_read_story&guid=0ebf4c66b541b979cb416db8,https://www.ruthenia.ru/folklore/berezkin/k33h.html,"Megas 2012, No. 560 : 235-238"
K35A,"The hero brands his rivals, ATU 530A.","Yazgulyam Residents",N/A,N/A,"the prince asks his father to give him such a wife that the ground cannot see her legs, the sun does not see her head, the stranger does not see her face; the vizier brought the old woman's newborn granddaughter was placed in a hole with seven doors; 18 years later, the prince opened a hole, where the girl was reading a book; she sent for a mullah; the king wants this woman for himself, but the vizier dissuaded her from killing son; the king sent the prince to trade; agrees to bet with the thief Yakturman: if he proves the infidelity of the prince's wife who remains at home, let him take all his property; the wife became invisible, but I. I learned from the old woman that there was a mole on her left shoulder; the king was told that his daughter-in-law had caused trouble to his son; he sent the torturers, their daughter-in-law beheaded them; threatened the king and put on men's clothes. flew by air to the city of Y. to visit her parents, said that she was kidnapped by peri, let her parents marry her now; thief Y. wants to marry her, fulfills the conditions: release prisoners, allow put a stamp on her ass, give away everything in the house; she flew away through the smoke hole, put on her royal clothes and, pretending to be a man, sat on the throne, forced Y. to show the stigma, confess to slander , separated his head from his body; returned her prince husband, hung that old woman",https://www.folkloredatabase.com/db_index.php?pl=db_read_story&guid=ffd371ce0fd1f301d0a1c1e2,https://www.ruthenia.ru/folklore/berezkin/k35a.html,
K36,"Turned into an animal, (ATU 449).",Mansi,62.71935,63.64844,"Endir-hum (“Yendyr man”) tells Nizyam-humu that his wife is unfaithful; N. finds his wife with her lover, who whips him, turns him into a dog; the Tobolsk merchant took the dog to him, gives it to the governor, he to the king; she beat off the royal baby from the crow; the king awarded the dog, returned it to the governor, he gave it to the village. Nizyama; ex-wife wants to take away the award, whips the dog, turns her into a crow; the old man caught her, whipped her, N. became human again, the old man gave him a whip; he hit his wife and lover with it, turning into horses; I rode them, did not feed them, they burned down in the fire",https://www.folkloredatabase.com/db_index.php?pl=db_read_story&guid=aeb3b89f86bfa0e5de34940f,https://www.ruthenia.ru/folklore/berezkin/k36.html,
K36,"Turned into an animal, (ATU 449).","Adygi, Abaza (Abazins), Abkhaz, Abkhazians, Karachays, Balkar, Ossetians, Chechens, Ingush, Georgians, Armenians",N/A,N/A,"Hasan the hunter killed a deer, gutted it, was going to fry, he jumped up, ran away; Hasan the mower he met replied that an even greater miracle had happened to him; on his wedding night, someone called him, whipped him, turning him into a horse; the stranger rode it all night, made him man again in the morning; and the next night; on the third G. is turned into a dog, runs away to the steppe; sees two witches sucking blood from two girls; rushes at them, making them regurgitate blood; they turn him back into a person (by stealing that whip) with with a promise not to talk about them; he cured those girls with blood, took a whip, turned his unfaithful wife and her new husband into donkeys",https://www.folkloredatabase.com/db_index.php?pl=db_read_story&guid=cc82cbecf0dab644d614206a,https://www.ruthenia.ru/folklore/berezkin/k36.html,
K36,"Turned into an animal, (ATU 449).","Adygi, Abaza (Abazins), Abkhaz, Abkhazians, Karachays, Balkar, Ossetians, Chechens, Ingush, Georgians, Armenians",N/A,N/A,"the lover of the Sultan's wife turned him into a black dog with a whip; with the help of a witch, the sultan stole the whip, regained his former appearance, turned his unfaithful wife and lover into donkeys",https://www.folkloredatabase.com/db_index.php?pl=db_read_story&guid=119321dfa20a5dea10dcb5f2,https://www.ruthenia.ru/folklore/berezkin/k36.html,
K36,"Turned into an animal, (ATU 449).","Adygi, Abaza (Abazins), Abkhaz, Abkhazians, Karachays, Balkar, Ossetians, Chechens, Ingush, Georgians, Armenians",N/A,N/A,"a man killed and refreshed a deer; while he went to wash his hands to the stream, the deer came to life and ran away; traveler: it's not a miracle, nearby a lake of living water; but what happened to Dervish is really a miracle; the hunter found Dervish, who tells us how he found out that his wife was cheating on him with a neighbor; when he reproached her, she hit him with a whip, turning him into a dog; becoming a dog, D. became friends with the village priest; he came to the shepherds; at night D. killed three wolves to protect the herd; the shepherds bought him, he became famous; he was brought to the sick princess; at night he killed 10 swans that trampled on her, and the 11th asked her to let her go, promising to help; the king gave the Dog D. a gold chain, but he ran away to his former wife; she turned him into a duck; the peasant caught her in the field, gave her wife to cook; she took the whip and restored D. to her human appearance; explained that he killed 10 sisters, she was the 11th, and his wife was the 12th; gave a whip; the man turned his wife and a lover with a pair of donkeys  -  here they are; the hunter ran away in horror",https://www.folkloredatabase.com/db_index.php?pl=db_read_story&guid=6a330d2e0e3eb1a4ff02cbbd,https://www.ruthenia.ru/folklore/berezkin/k36.html,
K36,"Turned into an animal, (ATU 449).","Bulgarians, Balkarians",42.5,25,"an unfaithful sorceress wife turns her husband into a dog; this dog saves sheep from wolves, the king's child from lamia; the wife turns the dog into a bird; another sorceress restores a human form to a bird; husband turns his wife and her lover into animals (oxen)",https://www.folkloredatabase.com/db_index.php?pl=db_read_story&guid=762df8ab022f4b459047007c,https://www.ruthenia.ru/folklore/berezkin/k36.html,
K38,"The hero helps the chicks, B364.4.","Northern Ukrainians",51.23,27.73,"the cow gave birth to a boy; the owner is going to slaughter her; the cow named the boy Belokorov (B.), tells him to run, flies with him under the clouds; orders him to pull him out sycamore root; B. cannot; the cow raises B. for a year, again orders to pull out the sycamore, B. pulled out; the cow flew away, B. found a golden sword; meets, takes Lupaikamen, Krutibuk, Hitaygora as companions; leveled the mountain and they built a house; they hunt and cook one by one; every time Liqutibeard comes, eats everything; B. remains the last, split the sycamore, pinched L.'s beard; he uprooted the sycamore and ran away; the twins are walking along trail to a hole in the ground; everyone tries to go down, afraid; B. went down; comes to the house, there is panna and L., he cut off L.'s head; there are three more girls; B. took them out, burned down the house with L.'s body; sends girls to his brothers upstairs; Suspecting his companions of infidelity, B. puts stones in his place, his companions cut the rope, lifting the stones to the middle; B. kills the 12 bears who attacked him; crawls out of the well the snake devour the eagle; B. killed the snake, the eagle hides it from its mother, then explains to her that B. is the savior; the eagle agrees to bring B. to the ground, let him store water and meat; there was not enough meat, B. cut off a piece from playing her leg; on the ground, the eagle asks what kind of sweet piece was the last; regurgitated and raised; B. meets the boy, this is his son from that panna, she is others cook; B. tells his companions throw a golden sword; when Krutybok and Hytaygora were thrown, the saber pierced the ground; when Lupaikamen cut off his head; Lupaikamen's wife became a cook",https://www.folkloredatabase.com/db_index.php?pl=db_read_story&guid=0aa6ce8055346fd463041266,https://www.ruthenia.ru/folklore/berezkin/k38.html,
K38B,"The serpent threatens the chicks, B364.4.","Northern Ukrainians",51.23,27.73,"cow gave birth to a boy; the owner is going to slaughter her; the cow named the boy Belokorov (B.), tells him to run, flies with him under the clouds; tells him to uproot the sycamore; B. cannot; the cow raises B. for a year, again tells snatch the sycamore, B. snatched out; the cow flew away, B. found a golden sword; meets, takes Lupaikamen, Krutibuk, Hitaigor as companions; razed the mountain and built a house; hunt and cook in turn; each time Lictiboroda comes, eats everything; B. is the last, split the sycamore, pinched L.'s beard; he uprooted the sycamore and ran away; the brothers follow the trail to the hole in the ground; everyone tries to go down, afraid; B. went down; comes to the house, where Panna and L., he cut off L.'s head; there are three more girls; B. took them out, burned down the house with L.'s body; sends the girls to his brothers upstairs; suspects companions in infidelity, B. puts stones in his place, companions cut off the rope, raising the stones to the middle; B. kills the 12 bears who attacked him; a snake crawls from the well to devour an eagle; B. killed a snake, the eagle hides him from his mother, then explains to her that B. is the savior; the eagle agrees to take B. to the ground, let him store water and meat; there was not enough meat, B. cut off a piece from the game of his leg; on the ground, the eagle asks what for the sweet piece was the last; regurgitated and raised; B. meets the boy, this is his son from that panna, she is a cook for others; B. tells his companions to throw a golden sword; when Krutybok and Hytaigor were abandoned, the saber pierced the ground; when Lupaikamen cut off his head; Lupaikamen's wife became a cook",https://www.folkloredatabase.com/db_index.php?pl=db_read_story&guid=6cf4d547ab5f530aa178a021,https://www.ruthenia.ru/folklore/berezkin/k38b.html,
K39,"Feeding the Simurgh bird, B322.1.","Northern Ukrainians",51.23,27.73,"the cow gave birth to a boy; the owner is going to slaughter her; the cow called the boy Belokorov (B.), tells him to run, flies with him under the clouds; tells him to uproot sycamore; B. cannot; the cow raises B. for a year, again tells him to pull out the sycamore, B. pulled out; the cow flew away, B. found golden saber; meets, takes Lupaikamen, Krutibuk, Hitaygoru as companions; they razed the mountain and built a house; they hunt and cook one by one; every time Liqutibeard comes, eats everything; B remains the last ., split the sycamore, pinched L.'s beard; he uprooted the sycamore and ran away; the twins follow the trail to the hole in the ground; everyone tries to go down, afraid; B. went down; comes to the house, there is panna and L., he cut off L.'s head; there are three more girls; B. took them out, burned down the house with L.'s body; sends the girls to his brothers upstairs; suspects his companions of infidelity, B. puts stones in place of himself, his companions cut off rope, lifting the stones to the middle; B. kills the 12 bears that attacked him; a snake crawls from the well to devour an eagle; B. killed the snake, the eagle hides it from its mother, then explains to her that B. is the savior; the eagle agrees to take B. to the ground, let him store water and meat; there was not enough meat, B. cut off a piece from the play of his leg; on the ground, the eagle asks what kind of sweet piece was the last; regurgitated and grew; B. meets a boy, this is his son from that panna, she is a cook for others; B. tells his companions to throw a golden sword; when Krutybok and Hytaigor were thrown, the saber pierced the ground; when Lupaykamen cut him off head; Lupaikamen's wife became a cook",https://www.folkloredatabase.com/db_index.php?pl=db_read_story&guid=4e222266e883e9369649875c,https://www.ruthenia.ru/folklore/berezkin/k39.html,
K43,"The abandoned survives and triumphs, S300.","Bella Coola (Nuxalk)",51.8,-127,"the son of a man named Nutsxoasenem loses all property and wife to Senxalolela 's son; people leave the loser alone, only a friend secretly tells where the fire is hidden; the snow extinguishes the fire; the woman tells the abandoned person to follow her, lets him eat a strip of meat from her chest, restoring his strength; they they come to the rock, the door to it opens and then slams shut; the young man slips; there is a holiday inside, these people are Wolves; he marries the Wolf who saved him; she says he should not smoke her blanket; at first he doesn't know it's a euphemism for infidelity; kills a lot of mountain sheep, Wolves bring meat; he calls him to play ball, his wife says her former husband was killed while playing; Wolf is ready gnaw a person's throat, but he throws the ball; no longer participates in the game; falls in love with a girl at the source; promises his wife that this is the last time; they go to live with his parents; he is met by the old wife; The she-wolf takes her son, leaves; he looks for her, becoming a wolf; Bobrikha tells him to go under water; there he reaches the country of the Wolves; the son rejoices at his father, the wife believes that he loves her; he stays with the Wolves",https://www.folkloredatabase.com/db_index.php?pl=db_read_story&guid=rxgw0u0wiuifcvray276aeih,https://www.ruthenia.ru/folklore/berezkin/k43.html,"bellacula : Boas 1898 : 103- 108"
K43,"The abandoned survives and triumphs, S300.",Kaska,60.5,-129,"husband He unjustly accuses his wife of being unfaithful; burns her clothes and tools, tells her to leave her alone; his sister secretly leaves fire for her; she catches rabbits, sews clothes; two brothers marry her, they get a lot of meat; the first husband is surprised to find out that she lives well; wants to buy her back; she throws his axes into the lake, burns arrows, drives her away",https://www.folkloredatabase.com/db_index.php?pl=db_read_story&guid=58dd59d5067fc37df93a89b9,https://www.ruthenia.ru/folklore/berezkin/k43.html,
K43C,"The dog unties the children.","Shan, Ahom, Khampti",22,98,"see motive L5; husband cuts off his head to an unfaithful wife, feeds her son and daughter with meat; the head chases his children, dies; children come to people; the father accuses them of killing their mother, tells them to tie them up and leave them; the old dog gnaws through the fetters; the girl kills animals with his gaze, the boy becomes a good hunter; people are starving; the girl sends the Raven to throw them a piece of fat; people come back; the girl tells two bears to tear her father to pieces; since then there are cannibal bears",https://www.folkloredatabase.com/db_index.php?pl=db_read_story&guid=17aca9214a2cb2186f9c42df,https://www.ruthenia.ru/folklore/berezkin/k43c.html,
K47A,"Woman and dog: the origin of humans.",Kirghiz,41.5,75,"the wife of the ruler of Khitâi was executed for infidelity; her forty maids (qïrq gïz) were driven into the steppe along with the yellow dog of the executed mistress from whom they became pregnant; they are Kyrgyz",https://www.folkloredatabase.com/db_index.php?pl=db_read_story&guid=d6c162eaacae15daa73c538a,https://www.ruthenia.ru/folklore/berezkin/k47a.html,
K53,"Animal skins – a means of transformation.",Kekci,N/A,N/A,"old man T'actani has a daughter X't'actani; she is a weaver and a spinner; Kin killed an antelope, filled a stuffed animal with ash and grass, carried Sh. past his house every evening; T. advised his daughter to pour water on the path; K. slipped, the scarecrow burst; then K. asked the hummingbird for his skin, giving him in return cotton wool so that it would not freeze; S. asked her father to shoot the hummingbird, who stunned him; at night in S. K. became a man; asked S. to get her father's magic stone mirror and wind tube, covered the mirror with soot, poured pepper into the tube; K. did not smoke one place in the mirror, T. saw K. and S. in the boat; not was able to shoot, almost suffocated; asked his Uncle Chac (Thunder) to kill the fugitives; K. turned into a turtle, S. turned into a crab, both dived to the bottom; after being hit, K. swam out, saw S.'s blood on the water; told the fish to collect it, but they began to eat flesh and drink blood; then he told the dragonflies, they collected them in 13 wooden decks; K. left them to the woman, promising to return in 13 days; opening the decks, K. found them in them various poisonous snakes (in the 1st), non-venomous snakes (2nd and 3rd), mosquitoes (4), sand fleas (5), green hornets (6), yellow wasps (7), small black wasps (8), the same but with white wings (9), white caterpillars with with poisonous hairs (10), flies (11 and 12), S. (13); K. sent a man to throw the first 12 decks into the sea; he heard a noise, discovered it out of curiosity, the creatures broke into the world; S. does not have a vagina; on the advice of old woman K. put S. between two hills, told a small deer to run, the trail was too small; the big one was just right; when he met S., K. decided that it was too tempting for people, told the Rat to write in vagina; since then, sex has been followed by disgust; K. found out that S. was cheating on him with his brother Shulab; he asked the turkey and another bird to give him their bile, asked the old woman for pepper, tinted everything with uruku, told the old woman to make a cake out of it, baked it in his armpit, gave it to her lovers; they began to spit, could not quench their thirst, S. ran to the river for a drink, agreed when Vulture offered to pick it up; takes Vultures to the village; the leader's house is supposedly made of stone, but this is guano; K. turned into a dead antelope, told the fly to lay down larvae; catches Vulture, tells him to be attributed to the leader; in the land of vultures hides in brushwood carried by a lumberjack, then comes to the village, holes 7 grains of corn, which causes Vulture to hurt his teeth, he lets him in to cure him; K. cures, puts them to sleep, takes Sh., tells two vultures to take them back; turns into the Sun, S. into the Moon, Shulab to the Morning Star, younger brother to the Evening Star; K. places a mirror at the zenith; each the day seems that in the afternoon he is moving further west, but in fact he returns to the east; at first S. is bright like him; she feels sorry for the people working continuously, K. takes out one eye for her",https://www.folkloredatabase.com/db_index.php?pl=db_read_story&guid=040b732113920cf5806e1953,https://www.ruthenia.ru/folklore/berezkin/k53.html,"Thompson 1930 (kekchi, mopan) : 126-132."
k56d1,"Treasures in a pumpkin.","Karen, Pa-O, Padaung, Kayah",18,97,"the rich Phatakain (""scoundrel"") envies the poor Phatalun (""good man"") because everyone loves him; he invites him to go on a ship for goods; he gives him food and drink in exchange for his eyes; he is left on a deserted island; the lord of the sea sends three servant nats in the form of dogs, whose names are the three truths of Buddhism; the dying man whispers these words, the nats think he knows their names, take human form, heal P., carry him home, giving him pumpkin seeds; the pumpkins grow, and inside them is gold and silver; Phatakain tries to repeat everything, orders his servant to gouge out his eyes; he chases and scolds the dogs, dies in agony; Phatulun arrives on the island, finds the bones and skull of Phatakain, the skull asks him to take it away and tell the king that he, Phatulun, has a talking skull; the skull remains silent before the king, and Phataluna is thrown into prison; Phataluna's wife hits the skull with a stick, it screams, and the king rewards Phataluna; the skull is thrown away and floats to an old man and an old woman; lies to the old woman that the old man is unfaithful to her; the old man breaks it, and a tree grows with fruit like skulls",https://www.folkloredatabase.com/db_index.php?pl=db_read_story&guid=q3oCcW8Aa02kar1KguQmNg,https://www.ruthenia.ru/folklore/berezkin/k56d1.html,"No. 172"
K59,"Osiris&#039;s chest.",Baluch,28,63,"the father married four sons, two were unmarried, went on a journey; woke up one night and went to look for the missing horses; the king died there, and a Simurg bird sat on the young man's head, his elected king, he forgot his brother; the merchant makes him a clerk; he solves the king's dream, exposing the infidelity of his wives; the king gives him a daughter; the merchant asks the young man to get the cup out of the chest, closes the lid , throws it into the river; the gardener finds a chest, frees the young man; he comes to the merchant's wedding, tells his story; the tsar brother recognizes him, executes the merchant, the young man celebrates his wedding",https://www.folkloredatabase.com/db_index.php?pl=db_read_story&guid=07878abfd2c5414a413fda4a,https://www.ruthenia.ru/folklore/berezkin/k59.html,
K60A,"Are the bonds strong?","Nuba, Arabs Of Sudan, Sudanese",19.35011,30.61523,"{there is some possibility that a cheating wife is not provoking allow the husband to bind himself, resorts to some other trick}",https://www.folkloredatabase.com/db_index.php?pl=db_read_story&guid=1b09c7e655b2d0deffdc870e,https://www.ruthenia.ru/folklore/berezkin/k60a.html,
K60C,"Stropiva with the king, patient with the groom.",Yagnobi,39.3,69,"Tsar tells Hasana Gulriz (“sprinkling flowers”) to come to his wedding; he does not go for a long time, says that the king's wife is unfaithful; finally he goes, meets the plowman, finds out that it is his wife's lover, drives his wife away; the king locks him in the stable; at night he sees how the king's wife went to the grooms, who beat her for not going out for a long time; HG laughs, by morning all the manure is covered with flowers; when he finds out what is going on, the king drives his wife away, and goes to wander with HG",https://www.folkloredatabase.com/db_index.php?pl=db_read_story&guid=059f16fd2e4e320158dcf94a,https://www.ruthenia.ru/folklore/berezkin/k60c.html,
K60C,"Stropiva with the king, patient with the groom.","One Thousand And One Nights",N/A,N/A,"half asleep, from a conversation between the maids, the king learns that his wife is cheating on him; he drinks him before going to bed, takes his sword, leaves; the king watches his wife; she goes to a slave sick with leprosy , humiliates himself before him; the king cuts the slave's neck with a sword brought by his wife (thinks that the slave is killed, but he is only wounded); the wife puts on mourning, builds a tomb for the slave; the slave after being wounded is half-alive, the king's wife is each the day visits him; three years later, the king goes after his wife; his wife witchcraft turns the lower half of his body into stone, and the inhabitants of the city into fish in the pond (white fish are Muslims, in red fish are magicians, in yellow fish - magicians, in yellow fish - Jews, Christians in blue); beats the king every day, dresses him in hair clothes; the sultan kills and throws the body of a slave into the well, pretends to be a slave, tells the woman to spell the king and the city, woman water talks, disagrees; the sultan stabbed a woman, cut it in half; the city has come to life; the sultan appoints the king of the enchanted city as heir; marries the fisherman's daughter, passes off the fisherman's second daughter as prince, appoints a fisherman's son as a vizier, makes a fisherman the richest man",https://www.folkloredatabase.com/db_index.php?pl=db_read_story&guid=2f43effb1aabe7527fa4e2fd,https://www.ruthenia.ru/folklore/berezkin/k60c.html,
